{
  "schema_version":"0.1.0",
  "brief_id":"LAB-SYMPHONIE-BRIEF-EXAMPLE-001",
  "status":"PROPOSED",
  "project_contract_ref":{"contract_id":"PFC-EXAMPLE-CRM-001","repository":"owner/example-crm","path":"project-contract/PROJECT_FOUNDATION_CONTRACT.json","version_or_commit":"DRAFT"},
  "resolved_context":{"applicable_rules":["INV-TENANT-001","PAT-STATE-001"],"applicable_patterns":["server-side authorization","atomic synthetic validation"],"rejected_patterns":["client-side secrets","stored configuration treated as proof of effective behavior"],"open_assumptions":["Expected peak load is not yet evidenced"],"source_refs":["foundation-library/project-contracts/PROJECT-FOUNDATION-CONTRACT-001/PROJECT_FOUNDATION_CONTRACT.example.json","projects/lab/evidence/EVD-LAB-PL003-PROPAGATION-AWARE-ATOMIC-SIMULATION-RETRY-127-ATTEMPT-001.json"]},
  "evaluation":{"outcome":"COMPLIANT_WITH_REQUIRED_MODIFICATIONS","findings":["Core flow is defined","Tenant isolation is critical","Observability and rollback are mandatory"],"uncertainty":["Peak load and recovery objectives remain unproven"],"required_modifications":["Define load envelope","Define RTO/RPO","Add cross-tenant negative test"],"next_phase_effect":"ALLOW_PLANNING_WITH_GATES"},
  "mandatory_gates":[{"gate_id":"GATE-TENANT-ISOLATION","phase":"validation","condition":"Cross-tenant access attempts must fail without side effects.","required_evidence":["negative test report","authorization trace"],"failure_effect":"BLOCK_RELEASE"},{"gate_id":"GATE-ROLLBACK","phase":"validation","condition":"Synthetic state must be fully removed and final state must match baseline.","required_evidence":["baseline hash","rollback log","final reconciliation"],"failure_effect":"BLOCK_RELEASE"}],
  "phase_inputs":{"discovery":["Validate user roles and data sensitivity"],"product":["Specify appointment lifecycle and error states"],"ux_ui":["Define empty, loading, error and permission-denied states"],"architecture":["Centralize authorization and tenant scoping"],"implementation":["Derive tests from invariants"],"validation":["Run atomic end-to-end synthetic flow"],"release":["Require evidence closure and zero residual synthetic state"]},
  "evidence_requirements":{"configured":["Deployed version and configuration manifest"],"effective":["Runtime health and authorization checks"],"behavior_verified":["End-to-end flow and negative isolation test"],"rollback_verified":["Final baseline equality and zero residual records"]},
  "authority_boundary":{"authority_effect":"NONE","planning_only":true,"runtime_authorized":false,"integration_authorized":false,"product_changes_authorized":false}
}
